{
  "$schema": "https://json-schema.org/draft/2020-12/schema",
  "$id": "https://beamkit.dev/schemas/rule-catalog.schema.json",
  "title": "BeamKit clinical rule catalog",
  "type": "object",
  "additionalProperties": false,
  "required": [ "name", "templateSets" ],
  "properties": {
    "name": { "type": "string", "minLength": 1 },
    "institution": { "type": "string", "minLength": 1 },
    "version": { "type": "string", "minLength": 1 },
    "description": { "type": "string", "minLength": 1 },
    "owner": { "type": "string", "minLength": 1 },
    "tags": {
      "type": "array",
      "items": { "type": "string", "minLength": 1 },
      "uniqueItems": true
    },
    "templateSets": {
      "type": "array",
      "minItems": 1,
      "items": { "$ref": "clinical-goal-template.schema.json" }
    }
  }
}
