{
  "name": "Prostate clinical rule catalog",
  "institution": "Synthetic",
  "version": "2026.1",
  "description": "Starter clinical goals for Prostate. Review locally before use.",
  "owner": "BeamKit",
  "tags": [
    "prostate",
    "starter"
  ],
  "templateSets": [
    {
      "name": "Prostate baseline",
      "diseaseSite": "Prostate",
      "institution": "Synthetic",
      "version": "2026.1",
      "description": "Baseline Prostate starter goals.",
      "owner": "BeamKit",
      "tags": [
        "baseline",
        "prostate"
      ],
      "goals": [
        {
          "id": "goal.target.d95",
          "structureName": "PTV_7000",
          "metricKey": "D95PercentDoseGy",
          "comparison": "GreaterThanOrEqual",
          "threshold": 66.50,
          "unit": "Gy",
          "severity": "Required",
          "description": "Target D95 coverage objective.",
          "reference": "Starter institutional baseline",
          "rationale": "Documents minimum target coverage for automated review.",
          "tags": [
            "target",
            "coverage",
            "prostate"
          ]
        },
        {
          "id": "goal.oar1.max",
          "structureName": "OAR_1",
          "metricKey": "MaxDoseGy",
          "comparison": "LessThanOrEqual",
          "threshold": 56.0,
          "unit": "Gy",
          "severity": "Warning",
          "description": "Synthetic OAR maximum dose review goal.",
          "reference": "Starter institutional baseline",
          "rationale": "Placeholder OAR objective that should be replaced with site-specific policy.",
          "tags": [
            "oar",
            "starter",
            "prostate"
          ]
        }
      ]
    }
  ]
}
